[
    {
    "id": "Bricks",
    "desc": "Fired clay bricks.",
    "icon": "content/items/building_resources/bricks.png",
    "price": 25,
    "sex": "unisex",
    "chance": 100,
    "badness": 100,
    "eqchance": 0,
    "hidden": false,
    "infinite": true,
    "slot": "resources",
    "type": "building",
    "locations": ["Work Shop", "Look around"]
    },
    {
    "id": "Stone",
    "desc": "Stone blocks carved directly from a rock. Sturdy, but heavy and expensive.",
    "icon": "content/items/building_resources/stone.png",
    "price": 55,
    "sex": "unisex",
    "chance": 100,
    "badness": 100,
    "eqchance": 0,
    "hidden": false,
    "infinite": true,
    "slot": "resources",
    "type": "building",
    "locations": ["Work Shop"]
    },
    {
    "id": "Green Marble",
    "desc": "Slabs of metamorphic rock commonly used for sculpture and as a building material.",
    "icon": "content/items/building_resources/marble.png",
    "price": 210,
    "sex": "unisex",
    "chance": 100,
    "badness": 100,
    "eqchance": 0,
    "hidden": false,
    "infinite": true,
    "slot": "resources",
    "type": "building",
    "locations": ["Work Shop"]
    },
    {
    "id": "Glass",
    "desc": "Amorphous transparent solid, primary constituent of sand.",
    "icon": "content/items/building_resources/glass.png",
    "price": 45,
    "sex": "unisex",
    "chance": 100,
    "badness": 100,
    "eqchance": 0,
    "hidden": false,
    "infinite": true,
    "slot": "resources",
    "type": "building",
    "locations": ["Work Shop", "Look around"]
    },
    {
    "id": "Wood",
    "desc": "Fresh wooden beams from the local forest.",
    "icon": "content/items/building_resources/wood.png",
    "price": 25,
    "sex": "unisex",
    "chance": 100,
    "badness": 100,
    "eqchance": 0,
    "hidden": false,
    "infinite": true,
    "slot": "resources",
    "type": "building",
    "locations": ["Work Shop", "Look around"]
    },
    {
    "id": "Nails",
    "desc": "Pin-shaped steel nails.",
    "icon": "content/items/building_resources/nails.png",
    "price": 5,
    "sex": "unisex",
    "chance": 100,
    "badness": 100,
    "eqchance": 0,
    "hidden": false,
    "infinite": true,
    "slot": "resources",
    "type": "building",
    "locations": ["Work Shop", "Look around"]
    }
]
