[
    {
    "id": "Anchovy",
    "desc": "A small, common forage fish.",
    "icon": "content/items/fish/anchovy.png",
    "price": 3,
    "chance": 90,
    "slot": "loot",
    "type": "fish",
    "locations": ["Fishing"]
    },
    {
    "id": "Bowfin",
    "desc": "A silent and agile underwater predator.",
    "icon": "content/items/fish/bowfin.png",
    "price": 10,
    "chance": 30,
    "slot": "loot",
    "type": "fish",
    "locations": ["Fishing"]
    },
    {
    "id": "Catfish",
    "desc": "A bony fish which barbels resemble a cat's whiskers.",
    "icon": "content/items/fish/catfish.png",
    "price": 8,
    "chance": 70,
    "slot": "loot",
    "type": "fish",
    "locations": ["Fishing"]
    },
    {
    "id": "Elephantfish",
    "desc": "A big fish with an ability to generate weak electric fields that allow it to sense environment.",
    "icon": "content/items/fish/elephant.png",
    "price": 20,
    "chance": 20,
    "slot": "loot",
    "type": "fish",
    "locations": ["Fishing"]
    },
    {
    "id": "Flying Fish",
    "desc": "An exotic fish capable to make powerful leaps out of water into air to evade predators.",
    "icon": "content/items/fish/flying_fish.png",
    "price": 15,
    "chance": 40,
    "slot": "loot",
    "type": "fish",
    "locations": ["Fishing"]
    },
    {
    "id": "Koi Carp",
    "desc": "A widespread partially domesticated fish often used for decorative purposes.",
    "icon": "content/items/fish/carp.png",
    "price": 5,
    "chance": 80,
    "slot": "loot",
    "type": "fish",
    "locations": ["Fishing"]
    },
    {
    "id": "Sea Urchin",
    "desc": "A small, spiny, globular animal resembling a hedgehog.",
    "icon": "content/items/fish/urchin.png",
    "price": 12,
    "chance": 50,
    "slot": "loot",
    "type": "fish",
    "locations": ["Fishing"]
    },
    {
    "id": "Tuna",
    "desc": "A large and heavy fish with lots of tasty meat. The main target of professional fishermen.",
    "icon": "content/items/fish/tuna.png",
    "price": 100,
    "chance": 15,
    "slot": "loot",
    "type": "fish",
    "locations": ["Fishing"]
    },
    {
    "id": "Sea Bass",
    "desc": "An elongated fish with a large mouth.",
    "icon": "content/items/fish/sea_bass.png",
    "price": 15,
    "chance": 30,
    "slot": "loot",
    "type": "fish",
    "locations": ["Fishing"]
    },
    {
    "id": "Clownfish",
    "desc": "A small omnivorous fish with a very unusual appearance. Can be found in most aquariums.",
    "icon": "content/items/fish/ruby.png",
    "price": 30,
    "chance": 25,
    "slot": "loot",
    "type": "fish",
    "locations": ["Fishing"]
    },
    {
    "id": "Abyssal Fish",
    "desc": "A deep-water fish capable of luminescence.",
    "icon": "content/items/fish/luminous.png",
    "price": 70,
    "chance": 15,
    "slot": "loot",
    "type": "fish",
    "locations": ["Fishing"]
    }
  ]