[{
    "id": "Fire Scroll",
    "desc": "This scroll contains the arcane formula of Fire spell.",
    "icon": "content/items/scrolls/fire.png",
    "price": 50,
    "sex": "unisex",
    "chance": 30,
    "badness": 80,
    "eqchance": 40,
    "hidden": false,
    "infinite": false,
    "slot": "consumable",
    "type": "scroll",
    "add_be_spells": ["Fire"]
    },
    {
    "id": "Fira Scroll",
    "desc": "This scroll contains the arcane formula of Fira spell.",
    "icon": "content/items/scrolls/fira.png",
    "price": 100,
    "sex": "unisex",
    "chance": 30,
    "badness": 80,
    "eqchance": 40,
    "hidden": false,
    "infinite": false,
    "slot": "consumable",
    "type": "scroll",
    "add_be_spells": ["Fira"]
    },
    {
    "id": "Firaga Scroll",
    "desc": "This scroll contains the arcane formula of Firaga spell.",
    "icon": "content/items/scrolls/firaga.png",
    "price": 150,
    "sex": "unisex",
    "chance": 30,
    "badness": 80,
    "eqchance": 40,
    "hidden": false,
    "infinite": false,
    "slot": "consumable",
    "type": "scroll",
    "add_be_spells": ["Firaga"]
    },
    {
    "id": "Firaja Scroll",
    "desc": "This scroll contains the arcane formula of Firaja spell.",
    "icon": "content/items/scrolls/firaja.png",
    "price": 200,
    "sex": "unisex",
    "chance": 30,
    "badness": 80,
    "eqchance": 40,
    "hidden": false,
    "infinite": false,
    "slot": "consumable",
    "type": "scroll",
    "add_be_spells": ["Firaja"]
    },
    {
    "id": "Fireball Scroll",
    "desc": "This scroll contains the arcane formula of Fireball spell.",
    "icon": "content/items/scrolls/fireball.png",
    "price": 250,
    "sex": "unisex",
    "chance": 30,
    "badness": 80,
    "eqchance": 40,
    "hidden": false,
    "infinite": false,
    "slot": "consumable",
    "type": "scroll",
    "add_be_spells": ["Fireball"]
    },
    {
    "id": "Solar Flash",
    "desc": "This scroll contains the arcane formula of Solar Flash spell.",
    "icon": "content/items/scrolls/solar_flash.png",
    "price": 300,
    "sex": "unisex",
    "chance": 30,
    "badness": 80,
    "eqchance": 40,
    "hidden": false,
    "infinite": false,
    "slot": "consumable",
    "type": "scroll",
    "add_be_spells": ["Solar Flash"]
    },
    {
    "id": "Meteor",
    "desc": "This scroll contains the arcane formula of Meteor spell.",
    "icon": "content/items/scrolls/meteor.png",
    "price": 300,
    "sex": "unisex",
    "chance": 30,
    "badness": 80,
    "eqchance": 40,
    "hidden": false,
    "infinite": false,
    "slot": "consumable",
    "type": "scroll",
    "add_be_spells": ["Meteor"]
    },
    {
    "id": "Flame Vortex",
    "desc": "This scroll contains the arcane formula of Flame Vortex spell.",
    "icon": "content/items/scrolls/flame_vortex.png",
    "price": 350,
    "sex": "unisex",
    "chance": 30,
    "badness": 80,
    "eqchance": 40,
    "hidden": false,
    "infinite": false,
    "slot": "consumable",
    "type": "scroll",
    "add_be_spells": ["Flame Vortex"]
    },
    {
    "id": "Cataclysm",
    "desc": "This scroll contains the arcane formula of Cataclysm spell.",
    "icon": "content/items/scrolls/cataclysm.png",
    "price": 400,
    "sex": "unisex",
    "chance": 30,
    "badness": 80,
    "eqchance": 40,
    "hidden": false,
    "infinite": false,
    "slot": "consumable",
    "type": "scroll",
    "add_be_spells": ["Cataclysm"]
    },
    {
    "id": "Water Scroll",
    "desc": "This scroll contains the arcane formula of Water spell.",
    "icon": "content/items/scrolls/water.png",
    "price": 50,
    "sex": "unisex",
    "chance": 30,
    "badness": 80,
    "eqchance": 40,
    "hidden": false,
    "infinite": false,
    "slot": "consumable",
    "type": "scroll",
    "add_be_spells": ["Water"]
    },
    {
    "id": "Watera Scroll",
    "desc": "This scroll contains the arcane formula of Watera spell.",
    "icon": "content/items/scrolls/watera.png",
    "price": 100,
    "sex": "unisex",
    "chance": 30,
    "badness": 80,
    "eqchance": 40,
    "hidden": false,
    "infinite": false,
    "slot": "consumable",
    "type": "scroll",
    "add_be_spells": ["Watera"]
    },
    {
    "id": "Waterga Scroll",
    "desc": "This scroll contains the arcane formula of Waterga spell.",
    "icon": "content/items/scrolls/waterga.png",
    "price": 150,
    "sex": "unisex",
    "chance": 30,
    "badness": 80,
    "eqchance": 40,
    "hidden": false,
    "infinite": false,
    "slot": "consumable",
    "type": "scroll",
    "add_be_spells": ["Waterga"]
    },
    {
    "id": "Waterja Scroll",
    "desc": "This scroll contains the arcane formula of Waterja spell.",
    "icon": "content/items/scrolls/waterja.png",
    "price": 200,
    "sex": "unisex",
    "chance": 30,
    "badness": 80,
    "eqchance": 40,
    "hidden": false,
    "infinite": false,
    "slot": "consumable",
    "type": "scroll",
    "add_be_spells": ["Waterja"]
    },
    {
    "id": "Geyser Scroll",
    "desc": "This scroll contains the arcane formula of Geyser spell.",
    "icon": "content/items/scrolls/geyser.png",
    "price": 250,
    "sex": "unisex",
    "chance": 30,
    "badness": 80,
    "eqchance": 40,
    "hidden": false,
    "infinite": false,
    "slot": "consumable",
    "type": "scroll",
    "add_be_spells": ["Geyser"]
    },
    {
    "id": "Heavy Rain",
    "desc": "This scroll contains the arcane formula of Heavy Rain spell.",
    "icon": "content/items/scrolls/heavy_rain.png",
    "price": 300,
    "sex": "unisex",
    "chance": 30,
    "badness": 80,
    "eqchance": 40,
    "hidden": false,
    "infinite": false,
    "slot": "consumable",
    "type": "scroll",
    "add_be_spells": ["Heavy Rain"]
    },
    {
    "id": "High Tide",
    "desc": "This scroll contains the arcane formula of High Tide spell.",
    "icon": "content/items/scrolls/high_tide.png",
    "price": 350,
    "sex": "unisex",
    "chance": 30,
    "badness": 80,
    "eqchance": 40,
    "hidden": false,
    "infinite": false,
    "slot": "consumable",
    "type": "scroll",
    "add_be_spells": ["High Tide"]
    }
  ]